{
  "headerId": 0,
  "timestamp": "1970-01-01T00:00:00Z",
  "version": "version",
  "manufacturer": "manufacturer",
  "serialNumber": "serial-number",
  "orderId": "some-order",
  "orderUpdateId": 0,
  "lastNodeId": "some-node",
  "lastNodeSequenceId": 0,
  "nodeStates": [
    {
      "nodeId": "node-with-node-position",
      "sequenceId": 0,
      "released": true,
      "nodeDescription": null,
      "nodePosition": {
        "x": 1.2,
        "y": 3.4,
        "mapId": "some-map-id",
        "theta": null,
        "allowedDeviationXY": null,
        "allowedDeviationTheta": null,
        "mapDescription": null
      }
    },
    {
      "nodeId": "node-without-node-position",
      "sequenceId": 0,
      "released": true,
      "nodeDescription": null,
      "nodePosition": null
    }
  ],
  "edgeStates": [
    {
      "edgeId": "edge-with-trajectory",
      "sequenceId": 0,
      "released": true,
      "edgeDescription": null,
      "trajectory": {
        "degree": 1.0,
        "knotVector": [0.0],
        "controlPoints": [{
            "x": 9.8,
            "y": 7.6,
            "weight": null
          }]
      }
    },
    {
      "edgeId": "edge-without-trajectory",
      "sequenceId": 0,
      "released": true,
      "edgeDescription": null,
      "trajectory": null
    }
  ],
  "driving": true,
  "actionStates": [{
      "actionId": "some-action-id",
      "actionType": null,
      "actionStatus": "FAILED",
      "actionDescription": null,
      "resultDescription": null
    }],
  "batteryState": {
    "batteryCharge": 50.0,
    "charging": false,
    "batteryVoltage": null,
    "batteryHealth": null,
    "reach": null
  },
  "operatingMode": "SEMIAUTOMATIC",
  "errors": [{
      "errorType": "some-error",
      "errorLevel": "FATAL",
      "errorReferences": null,
      "errorDescription": null
    }],
  "safetyState": {
    "eStop": "AUTOACK",
    "fieldViolation": false
  },
  "zoneSetId": null,
  "agvPosition": {
    "x": 2.1,
    "y": 5.4,
    "theta": 0.3,
    "mapId": "some-map-id",
    "positionInitialized": true,
    "mapDescription": null,
    "localizationScore": null,
    "deviationRange": null
  },
  "velocity": {
    "vx": null,
    "vy": null,
    "omega": null
  },
  "loads": [
    {
      "loadId": null,
      "loadType": null,
      "loadPosition": null,
      "weight": null,
      "boundingBoxReference": {
        "x": 0.0,
        "y": 0.0,
        "z": 0.0,
        "theta": null
      },
      "loadDimensions": {
        "length": 0.0,
        "width": 0.0,
        "height": null
      }
    },
    {
      "loadId": null,
      "loadType": null,
      "loadPosition": null,
      "weight": null,
      "boundingBoxReference": null,
      "loadDimensions": null
    }
  ],
  "paused": null,
  "newBaseRequest": null,
  "distanceSinceLastNode": null,
  "information": [{
      "infoType": "some-info",
      "infoLevel": "DEBUG",
      "infoDescription": null,
      "infoReferences": null
    }]
}